{
  "schemaVersion": "highlight-map.v2",
  "sourceId": "contract-markdown",
  "scopeKey": "document",
  "generatedAudioId": "contract-audio-word",
  "speechPlanId": "contract-markdown",
  "contentIrVersion": "content-ir.v1",
  "generatedAt": "2026-05-26T06:14:00Z",
  "durationMs": 1700,
  "timingLevels": ["word", "phrase", "sentence", "block"],
  "summary": {
    "status": "complete",
    "primaryLevel": "word",
    "entryCount": 4,
    "wordCount": 4,
    "phraseCount": 0,
    "sentenceCount": 0,
    "blockCount": 0,
    "timingSources": ["provider-word"],
    "confidence": 0.96,
    "driftBudgetMs": 150,
    "fallbackMode": "none",
    "degraded": false,
    "reason": "trusted provider word timings bind every spoken token to Content IR"
  },
  "entries": [
    {
      "entryId": "word-0001",
      "level": "word",
      "sourceId": "contract-markdown",
      "scopeKey": "document",
      "generatedAudioId": "contract-audio-word",
      "speechPlanId": "contract-markdown",
      "contentIrVersion": "content-ir.v1",
      "sourceLocator": {
        "type": "markdown",
        "markdown": {
          "path": "contract.md",
          "lineStart": 3,
          "lineEnd": 3,
          "columnStart": 1,
          "columnEnd": 22,
          "astPath": "/children/1"
        }
      },
      "nodeId": "md-0001",
      "segmentId": "seg-0001",
      "textQuote": "Dr Nguyen shipped v1.",
      "rawText": "Dr",
      "normalizedText": "Dr",
      "spokenText": "Doctor",
      "tokenIndex": 0,
      "fragmentIndex": 0,
      "sentenceIndex": 0,
      "audioStartMs": 0,
      "audioEndMs": 280,
      "providerTimingStartMs": 0,
      "providerTimingEndMs": 276,
      "alignedStartMs": 0,
      "alignedEndMs": 280,
      "timingSource": "provider-word",
      "confidence": 0.97,
      "driftBudgetMs": 150,
      "alignmentWarnings": [],
      "fallbackMode": "none",
      "traceability": {
        "sourceTextMatch": "Dr",
        "spokenTextMatch": "Doctor",
        "policyTransform": "project lexicon"
      }
    },
    {
      "entryId": "word-0002",
      "level": "word",
      "sourceId": "contract-markdown",
      "scopeKey": "document",
      "generatedAudioId": "contract-audio-word",
      "speechPlanId": "contract-markdown",
      "contentIrVersion": "content-ir.v1",
      "sourceLocator": {
        "type": "markdown",
        "markdown": {
          "path": "contract.md",
          "lineStart": 3,
          "lineEnd": 3,
          "columnStart": 1,
          "columnEnd": 22,
          "astPath": "/children/1"
        }
      },
      "nodeId": "md-0001",
      "segmentId": "seg-0001",
      "textQuote": "Dr Nguyen shipped v1.",
      "rawText": "Nguyen",
      "normalizedText": "Nguyen",
      "spokenText": "Nguyen",
      "tokenIndex": 1,
      "fragmentIndex": 0,
      "sentenceIndex": 0,
      "audioStartMs": 280,
      "audioEndMs": 700,
      "providerTimingStartMs": 276,
      "providerTimingEndMs": 704,
      "alignedStartMs": 280,
      "alignedEndMs": 700,
      "timingSource": "provider-word",
      "confidence": 0.98,
      "driftBudgetMs": 150,
      "alignmentWarnings": [],
      "fallbackMode": "none"
    },
    {
      "entryId": "word-0003",
      "level": "word",
      "sourceId": "contract-markdown",
      "scopeKey": "document",
      "generatedAudioId": "contract-audio-word",
      "speechPlanId": "contract-markdown",
      "contentIrVersion": "content-ir.v1",
      "sourceLocator": {
        "type": "markdown",
        "markdown": {
          "path": "contract.md",
          "lineStart": 3,
          "lineEnd": 3,
          "columnStart": 1,
          "columnEnd": 22,
          "astPath": "/children/1"
        }
      },
      "nodeId": "md-0001",
      "segmentId": "seg-0001",
      "textQuote": "Dr Nguyen shipped v1.",
      "rawText": "shipped",
      "normalizedText": "shipped",
      "spokenText": "shipped",
      "tokenIndex": 2,
      "fragmentIndex": 0,
      "sentenceIndex": 0,
      "audioStartMs": 700,
      "audioEndMs": 1080,
      "providerTimingStartMs": 704,
      "providerTimingEndMs": 1082,
      "alignedStartMs": 700,
      "alignedEndMs": 1080,
      "timingSource": "provider-word",
      "confidence": 0.97,
      "driftBudgetMs": 150,
      "alignmentWarnings": [],
      "fallbackMode": "none"
    },
    {
      "entryId": "word-0004",
      "level": "word",
      "sourceId": "contract-markdown",
      "scopeKey": "document",
      "generatedAudioId": "contract-audio-word",
      "speechPlanId": "contract-markdown",
      "contentIrVersion": "content-ir.v1",
      "sourceLocator": {
        "type": "markdown",
        "markdown": {
          "path": "contract.md",
          "lineStart": 3,
          "lineEnd": 3,
          "columnStart": 1,
          "columnEnd": 22,
          "astPath": "/children/1"
        }
      },
      "nodeId": "md-0001",
      "segmentId": "seg-0001",
      "textQuote": "Dr Nguyen shipped v1.",
      "rawText": "v1.",
      "normalizedText": "v1",
      "spokenText": "version one",
      "tokenIndex": 3,
      "fragmentIndex": 0,
      "sentenceIndex": 0,
      "audioStartMs": 1080,
      "audioEndMs": 1700,
      "providerTimingStartMs": 1082,
      "providerTimingEndMs": 1700,
      "alignedStartMs": 1080,
      "alignedEndMs": 1700,
      "timingSource": "provider-word",
      "confidence": 0.94,
      "driftBudgetMs": 150,
      "alignmentWarnings": [],
      "fallbackMode": "none",
      "traceability": {
        "sourceTextMatch": "v1.",
        "spokenTextMatch": "version one",
        "policyTransform": "say-as number"
      }
    }
  ]
}
